{
  "$schema": "https://json-schema.org/draft/2020-12/schema",
  "$id": "baseline/v6/contracts/case_card.schema.v6.json",
  "title": "Financial Agent Benchmark case_card (baseline v6)",
  "description": "Minimal-viable successor of contracts/case_card.schema.v1.json (removed with the baseline-v1 frozen directories per PER-323 cleanup list v1; rollback SHA in supersedes). Semantics follow docs/contracts/case-data-contracts.md with baseline-v6 additions: per-case registered critical invariants, evidence-tier labeling requirement, and an oracle block binding two independent implementations by file hash.",
  "type": "object",
  "required": [
    "contract_type",
    "contract_version",
    "case_id",
    "revision",
    "status",
    "source",
    "variant",
    "task",
    "financial_subject",
    "temporal",
    "risk",
    "quality",
    "evidence_refs",
    "evidence_contract",
    "claim_label_contract",
    "oracle",
    "applicable_critical_invariants",
    "future_information_prohibited",
    "lineage",
    "integrity"
  ],
  "properties": {
    "contract_type": { "const": "case_card" },
    "contract_version": { "const": "6.0.0" },
    "case_id": { "type": "string", "minLength": 1 },
    "revision": { "type": "integer", "minimum": 1 },
    "status": { "const": "frozen" },
    "family_key": { "type": "string", "pattern": "^[0-9a-f]{64}$" },
    "source": { "$ref": "#/$defs/source" },
    "variant": {
      "type": "object",
      "required": ["family_id", "kind", "parent_case_id", "changed_factors"],
      "properties": {
        "family_id": { "type": "string", "minLength": 1 },
        "kind": { "enum": ["normal", "single_factor_perturbation", "missing_or_anomalous"] },
        "parent_case_id": { "type": ["string", "null"] },
        "changed_factors": { "type": "array", "items": { "type": "string", "minLength": 1 } },
        "variant_axis": { "type": ["string", "null"] }
      },
      "additionalProperties": false
    },
    "task": {
      "type": "object",
      "required": ["domain", "prompt", "inputs", "method_id", "permissions", "expected_final_environment_state"],
      "properties": {
        "domain": { "enum": ["research", "valuation", "risk", "portfolio", "wealth_compliance", "operations"] },
        "prompt": { "type": "string", "minLength": 1 },
        "inputs": { "type": "object" },
        "method_id": { "type": "string", "minLength": 1 },
        "permissions": {
          "type": "object",
          "required": ["allowed_operations"],
          "properties": {
            "allowed_operations": { "type": "array", "items": { "type": "string" }, "minItems": 1, "uniqueItems": true }
          },
          "additionalProperties": false
        },
        "expected_final_environment_state": { "type": "object", "minProperties": 1 },
        "required_tools": { "type": "array", "items": { "type": "string" } },
        "initial_state": { "type": ["object", "null"] }
      },
      "additionalProperties": false
    },
    "financial_subject": { "$ref": "#/$defs/financial_subject" },
    "temporal": {
      "type": "object",
      "required": ["event_time", "as_of", "available_at_cutoff"],
      "properties": {
        "event_time": { "$ref": "#/$defs/timestamp" },
        "as_of": { "$ref": "#/$defs/timestamp" },
        "available_at_cutoff": { "$ref": "#/$defs/timestamp" }
      },
      "additionalProperties": false
    },
    "risk": {
      "type": "object",
      "required": ["level", "loss_category", "rationale"],
      "properties": {
        "level": { "enum": ["low", "medium", "high", "critical"] },
        "loss_category": { "type": "string", "minLength": 1 },
        "rationale": { "type": "string", "minLength": 1 }
      },
      "additionalProperties": false
    },
    "quality": {
      "type": "object",
      "required": ["tier", "ranking_eligible", "independently_recomputable", "rationale"],
      "properties": {
        "tier": { "enum": ["Gold", "Silver"] },
        "ranking_eligible": { "type": "boolean" },
        "independently_recomputable": { "type": "boolean" },
        "rationale": { "type": "string", "minLength": 1 }
      },
      "additionalProperties": false
    },
    "evidence_refs": {
      "type": "array",
      "minItems": 1,
      "items": {
        "type": "object",
        "required": ["snapshot_id", "snapshot_sha256", "record_ids", "evidence_type"],
        "properties": {
          "snapshot_id": { "type": "string", "minLength": 1 },
          "snapshot_sha256": { "$ref": "#/$defs/sha256" },
          "record_ids": { "type": "array", "items": { "type": "string" }, "uniqueItems": true },
          "evidence_type": { "type": "string", "minLength": 1 }
        },
        "additionalProperties": false
      }
    },
    "evidence_contract": {
      "type": "object",
      "required": ["registered_record_ids", "material_record_ids", "minimum_material_evidence_count", "rule"],
      "properties": {
        "registered_record_ids": { "type": "array", "items": { "type": "string" }, "uniqueItems": true },
        "material_record_ids": { "type": "array", "items": { "type": "string" }, "uniqueItems": true },
        "minimum_material_evidence_count": { "type": "integer", "minimum": 0 },
        "rule": { "type": "string", "minLength": 1 }
      },
      "additionalProperties": false
    },
    "claim_label_contract": {
      "type": "object",
      "required": ["required_for_answer", "labels_must_exactly_cover_claims", "allowed_tiers"],
      "properties": {
        "required_for_answer": { "type": "boolean" },
        "labels_must_exactly_cover_claims": { "const": true },
        "allowed_tiers": {
          "type": "array",
          "const": ["research_direct_evidence", "financial_inference", "illustrative_case"]
        }
      },
      "additionalProperties": false
    },
    "oracle": {
      "description": "The oracle consumes task.inputs verbatim (single source of truth, baseline-v1 lineage); no separate oracle input block exists.",
      "type": "object",
      "required": [
        "spec_version",
        "implementation",
        "implementation_sha256",
        "reference_implementation",
        "reference_implementation_sha256",
        "expected_status",
        "expected_value",
        "reason_codes"
      ],
      "properties": {
        "spec_version": { "type": "string", "minLength": 1 },
        "implementation": { "type": "string", "minLength": 1 },
        "implementation_sha256": { "$ref": "#/$defs/sha256" },
        "reference_implementation": { "type": "string", "minLength": 1 },
        "reference_implementation_sha256": { "$ref": "#/$defs/sha256" },
        "expected_status": { "enum": ["answer", "abstain", "escalate", "reject_action"] },
        "expected_value": {},
        "reason_codes": { "type": "array", "items": { "type": "string" }, "uniqueItems": true }
      },
      "additionalProperties": false
    },
    "applicable_critical_invariants": {
      "type": "array",
      "minItems": 1,
      "uniqueItems": true,
      "items": {
        "enum": [
          "point_in_time_and_no_future_information",
          "evidence_supports_material_claims",
          "calculation_reproducible_and_units_correct",
          "method_applicable_to_scenario",
          "no_unauthorized_or_duplicate_action",
          "required_abstention_or_escalation_observed",
          "final_environment_state_correct",
          "no_sensitive_data_disclosure"
        ]
      }
    },
    "evidence_tier_requirement": { "type": "boolean" },
    "answer_value_schema": { "type": "object" },
    "status_value_contract": { "type": "object" },
    "reason_code_vocabulary_ref": {
      "type": "object",
      "required": ["path", "sha256"],
      "properties": {
        "path": { "type": "string", "minLength": 1 },
        "sha256": { "$ref": "#/$defs/sha256" }
      },
      "additionalProperties": false
    },
    "future_information_prohibited": { "const": true },
    "lineage": {
      "type": "object",
      "required": ["generator", "generator_version", "code_revision", "generated_at"],
      "properties": {
        "generator": { "type": "string", "minLength": 1 },
        "generator_version": { "type": "string", "minLength": 1 },
        "code_revision": { "type": "string", "minLength": 1 },
        "generated_at": { "$ref": "#/$defs/timestamp" },
        "source_case_id": { "type": ["string", "null"] },
        "parent_case_id": { "type": ["string", "null"] }
      },
      "additionalProperties": false
    },
    "integrity": { "$ref": "#/$defs/integrity" }
  },
  "additionalProperties": false,
  "$defs": {
    "timestamp": { "type": "string", "pattern": "^\\d{4}-\\d{2}-\\d{2}T\\d{2}:\\d{2}:\\d{2}(\\.\\d+)?Z$" },
    "sha256": { "type": "string", "pattern": "^[0-9a-f]{64}$" },
    "license": {
      "type": "object",
      "required": ["name", "url", "redistributable"],
      "properties": {
        "name": { "type": "string", "minLength": 1 },
        "url": { "type": "string", "format": "uri" },
        "redistributable": { "type": "boolean" }
      },
      "additionalProperties": false
    },
    "source": {
      "type": "object",
      "required": ["provider", "source_type", "dataset", "uri", "license"],
      "properties": {
        "provider": { "type": "string", "minLength": 1 },
        "source_type": {
          "enum": ["market_data", "filing", "announcement", "fundamentals", "valuation", "macro", "corporate_action", "benchmark", "synthetic_fixture"]
        },
        "dataset": { "type": "string", "minLength": 1 },
        "uri": { "type": "string", "minLength": 1 },
        "license": { "$ref": "#/$defs/license" }
      },
      "additionalProperties": false
    },
    "financial_subject": {
      "type": "object",
      "required": ["entity_name", "subject_type", "identifiers", "market", "currency", "units"],
      "properties": {
        "entity_name": { "type": "string", "minLength": 1 },
        "subject_type": { "enum": ["security", "synthetic_security", "issuer", "macro_series", "accounting_concept"] },
        "identifiers": {
          "type": "array",
          "minItems": 1,
          "items": {
            "type": "object",
            "required": ["scheme", "value"],
            "properties": {
              "scheme": { "type": "string", "minLength": 1 },
              "value": { "type": "string", "minLength": 1 }
            },
            "additionalProperties": false
          }
        },
        "market": {
          "type": "object",
          "required": ["mic", "country", "timezone"],
          "properties": {
            "mic": { "type": "string", "pattern": "^[A-Z0-9]{4}$" },
            "country": { "type": "string", "pattern": "^[A-Z]{2}$" },
            "timezone": { "type": "string", "minLength": 1 }
          },
          "additionalProperties": false
        },
        "currency": {
          "type": "object",
          "required": ["code"],
          "properties": { "code": { "type": "string", "pattern": "^[A-Z]{3}$" } },
          "additionalProperties": false
        },
        "units": {
          "type": "object",
          "required": ["amount_scale", "accounting_basis", "price_basis"],
          "properties": {
            "amount_scale": { "type": "string", "minLength": 1 },
            "accounting_basis": { "type": "string", "minLength": 1 },
            "price_basis": { "type": "string", "minLength": 1 }
          },
          "additionalProperties": false
        }
      },
      "additionalProperties": false
    },
    "integrity": {
      "type": "object",
      "required": ["canonicalization", "hash_algorithm", "content_sha256"],
      "properties": {
        "canonicalization": { "const": "financial-agent-c14n-json-v1" },
        "hash_algorithm": { "const": "sha256" },
        "content_sha256": { "$ref": "#/$defs/sha256" }
      },
      "additionalProperties": false
    }
  },
  "supersedes": {
    "path": "baseline/v5/contracts/case_card.schema.v5.json",
    "sha256": "f11dd01d87a4b33e9c32153ff64e6041a096a25fe2e10096845de4fc655c0e7f",
    "reason": "PER-330 fourth audit: v6 is append-only and externally anchors registry path and SHA commitments; v5 remains historical failure evidence."
  }
}
