{
  "answer_value_schema": {
    "additionalProperties": false,
    "properties": {
      "period_end": {
        "type": "string"
      },
      "value": {
        "pattern": "^-?\\d+$",
        "type": "string"
      }
    },
    "required": [
      "period_end",
      "value"
    ],
    "type": "object"
  },
  "applicable_critical_invariants": [
    "point_in_time_and_no_future_information",
    "evidence_supports_material_claims",
    "calculation_reproducible_and_units_correct",
    "method_applicable_to_scenario",
    "no_unauthorized_or_duplicate_action",
    "required_abstention_or_escalation_observed",
    "final_environment_state_correct",
    "no_sensitive_data_disclosure"
  ],
  "case_id": "case-fkw5-pub-02-normal-v6",
  "claim_label_contract": {
    "allowed_tiers": [
      "research_direct_evidence",
      "financial_inference",
      "illustrative_case"
    ],
    "labels_must_exactly_cover_claims": true,
    "required_for_answer": true
  },
  "contract_type": "case_card",
  "contract_version": "6.0.0",
  "evidence_contract": {
    "material_record_ids": [
      "FKW5-PUB-02-AAPL-FY2024"
    ],
    "minimum_material_evidence_count": 1,
    "registered_record_ids": [
      "FKW5-PUB-02-AAPL-FY2023",
      "FKW5-PUB-02-AAPL-FY2024"
    ],
    "rule": "cite at least the stated number of preregistered material records; non-material registered records are optional"
  },
  "evidence_refs": [
    {
      "evidence_type": "xbrl_fact",
      "record_ids": [
        "FKW5-PUB-02-AAPL-FY2023",
        "FKW5-PUB-02-AAPL-FY2024"
      ],
      "snapshot_id": "snapshot-sec-edgar-aapl-netincome-v6-01",
      "snapshot_sha256": "2327c14c5505771700406b5734f24263453fe26531da7e692459f255175de5fb"
    }
  ],
  "evidence_tier_requirement": true,
  "family_key": "7fe17efde9bde2097dd9edf97fb262cf05775ad50e9f46817bfc382ee5ff3f21",
  "financial_subject": {
    "currency": {
      "code": "USD"
    },
    "entity_name": "Apple Inc.",
    "identifiers": [
      {
        "scheme": "SEC_CIK",
        "value": "CIK0000320193"
      },
      {
        "scheme": "US_GAAP_TAG",
        "value": "NetIncomeLoss"
      }
    ],
    "market": {
      "country": "US",
      "mic": "XXXX",
      "timezone": "UTC"
    },
    "subject_type": "accounting_concept",
    "units": {
      "accounting_basis": "US GAAP, as filed in the referenced 10-K",
      "amount_scale": "USD unit (as filed)",
      "price_basis": "not_applicable"
    }
  },
  "future_information_prohibited": true,
  "integrity": {
    "canonicalization": "financial-agent-c14n-json-v1",
    "content_sha256": "b35512f5659dfbf52958fe9fe8a0ef6d2299d03da3c355648dcf59beb7673499",
    "hash_algorithm": "sha256"
  },
  "lineage": {
    "code_revision": "cbdfb99e43618d5866ce158a7a9843e4893f810c",
    "generated_at": "2026-08-18T02:01:08Z",
    "generator": "baseline/v6/build/build_baseline_v6.py",
    "generator_version": "1.0.0",
    "parent_case_id": null,
    "source_case_id": null
  },
  "oracle": {
    "expected_status": "answer",
    "expected_value": {
      "period_end": "2024-09-28",
      "value": "93736000000"
    },
    "implementation": "src/financial_agent_reliability/oracles/public_filings/oracle.py",
    "implementation_sha256": "521fba3f94cf0cd2ab1e1093f3b61d90784515f3f9d2b1cc39c8687045c48864",
    "reason_codes": [],
    "reference_implementation": "src/financial_agent_reliability/oracles/public_filings/oracle_reference.py",
    "reference_implementation_sha256": "9a24b3be9ae5da06cea4b729bfc011888a9e7efdba0a680871f4b93b76db959f",
    "spec_version": "baseline-v6/1.0.0"
  },
  "quality": {
    "independently_recomputable": true,
    "ranking_eligible": true,
    "rationale": "Two independent deterministic oracle implementations agree on the registered expectation.",
    "tier": "Gold"
  },
  "reason_code_vocabulary_ref": {
    "path": "baseline/v6/contracts/reason_codes.v6.json",
    "sha256": "116a55768562f6d841ed4664ea12826cebf65834ba855fba59b63311842d40b9"
  },
  "revision": 1,
  "risk": {
    "level": "high",
    "loss_category": "decision_error_from_wrong_figure",
    "rationale": "Using a figure that was not yet available at the decision time is future-information contamination; research conclusions built on it are unsound."
  },
  "source": {
    "dataset": "SEC EDGAR primary disclosure, Apple Inc. 10-K filings (re-collected with lineage; no public benchmark answer reused)",
    "license": {
      "name": "US public domain (SEC EDGAR government data)",
      "redistributable": true,
      "url": "https://www.sec.gov/edgar"
    },
    "provider": "sec_edgar",
    "source_type": "filing",
    "uri": "https://www.sec.gov/cgi-bin/browse-edgar?action=getcompany&CIK=0000320193"
  },
  "status": "frozen",
  "status_value_contract": {
    "abstain|escalate|reject_action": "value must be null",
    "answer": "value must match answer_value_schema"
  },
  "task": {
    "domain": "research",
    "expected_final_environment_state": {
      "state": "unchanged"
    },
    "initial_state": null,
    "inputs": {
      "available_at_cutoff": "2025-06-01T00:00:00Z",
      "operation": "select_latest_available"
    },
    "method_id": "select_latest_available",
    "permissions": {
      "allowed_operations": [
        "read_snapshot"
      ]
    },
    "prompt": "As of the registered decision time, report the most recent annual NetIncomeLoss of Apple Inc. that was publicly available at that time, using only the frozen evidence. Records that became available after the decision time must not be used. Submit action 'answer' with value {period_end, value} citing the material record.",
    "required_tools": [
      "read_frozen_case",
      "read_frozen_evidence",
      "calculate"
    ]
  },
  "temporal": {
    "as_of": "2025-06-01T00:00:00Z",
    "available_at_cutoff": "2025-06-01T00:00:00Z",
    "event_time": "2024-09-28T00:00:00Z"
  },
  "variant": {
    "changed_factors": [],
    "family_id": "FKW5-PUB-02",
    "kind": "normal",
    "parent_case_id": null,
    "variant_axis": "as_of_time"
  }
}
